{
  "schema_version": "1.0.0",
  "request_id": "11111111-1111-1111-1111-111111111111",
  "material": "Aluminum 6061",
  "material_code": "AL6061",
  "stock_form": "block",
  "declared_operations": [
    {
      "op": "cut_stock",
      "params": {
        "duration_min": 12
      }
    },
    {
      "op": "face_mill",
      "target": "top_face",
      "params": {
        "duration_min": 35
      }
    },
    {
      "op": "drill",
      "target": "mount_hole_1",
      "params": {
        "duration_min": 18
      }
    },
    {
      "op": "drill",
      "target": "mount_hole_2",
      "params": {
        "duration_min": 18
      }
    },
    {
      "op": "deburr",
      "params": {
        "duration_min": 10
      }
    },
    {
      "op": "inspect",
      "params": {
        "duration_min": 15
      }
    }
  ],
  "quantity": 25,
  "tolerances": {
    "general_tolerance_mm": 0.1
  },
  "step_artifact_ref": {
    "media_type": "model/step",
    "id": "99999999-9999-9999-9999-999999999999",
    "content_hash": "sha256:cccccccccccccccccccccccccccccccccccccccccccccccccccccccccccccccc"
  },
  "metadata": {
    "author": "RM10 test fixture: declared operation times are test inputs, not manufacturing data"
  }
}
